{
  "schema": "don.release-source-archive-reproducibility.v2",
  "scope": {
    "candidate": {
      "path": "web/public/wasm/don_web.wasm",
      "size": 869993,
      "sha256": "f7fb5c4767537352cc9bc043e34e76856f0e60630e234548beaa4fbc7a031181"
    },
    "component_provenance": {
      "path": "release/web-wasm-component-provenance.json",
      "size": 7165,
      "sha256": "23fd23c1fb3134c7c0823d432616ee9d158389e5a98b5ca18a0b642ed4c69b4d"
    },
    "manifest": {
      "path": "web/wasm/Cargo.toml",
      "size": 940,
      "sha256": "89b4c512524be8641c707f7feab5baee18369ed51b7dedd68ed3e67780601ce9"
    },
    "lock": {
      "path": "web/wasm/Cargo.lock",
      "size": 737,
      "sha256": "7f311db3db512ef3d3b1b74c3455ec5513a3a1d6f2f8e12c3291f750bffe35d0"
    },
    "build_command": [
      "web/build.sh"
    ],
    "pipeline_inputs": [
      {
        "path": "schema/command-wire.json",
        "size": 24622,
        "sha256": "7b2e8e6025e9dab2228d8e56d7f754521386b794ea9407c89fe13fc25340fb99"
      },
      {
        "path": "schema/replay-validation.json",
        "size": 5009399,
        "sha256": "cf7217c2f04626c44a38d65e13aeb5a4026063f71620030b2e362ee376a45b44"
      },
      {
        "path": "web/build.sh",
        "size": 4506,
        "sha256": "8c167d6a900817973893215986df59328656a316a22919e318cfdce271c8be50"
      },
      {
        "path": "web/public/js/play/client.js",
        "size": 144840,
        "sha256": "53c9488394150705414c6e245f40b80d452f7f053183f5e7cf0625b89859e915"
      },
      {
        "path": "web/public/js/play/readiness.gen.js",
        "size": 787,
        "sha256": "1a117238e99517427b1de01e184694d4071d9b9a0ab229242b877b2c0f8c468c"
      },
      {
        "path": "web/public/js/play/wasm-contract.mjs",
        "size": 3283,
        "sha256": "3b8d6aa0cfdd5816afc3b23192891d51c0f7cf31839d900d630f5cce074781ce"
      },
      {
        "path": "web/public/js/play/wasmgame.js",
        "size": 18445,
        "sha256": "443b4f0d7ba823797ca73232a0c5a4285e6853d6d149665f29b2a9a7ca0f3270"
      },
      {
        "path": "web/public/js/wire.gen.js",
        "size": 34463,
        "sha256": "f3187e19dc31b65a19d66e023d784ec32af58f17b346ae5032572d5270a4acc4"
      },
      {
        "path": "web/tools/check-play-wasm.mjs",
        "size": 2606,
        "sha256": "c1ada4bae8015193ff1d68c95124a5c719a3ca38e82ad17b0c6d74b5da576852"
      },
      {
        "path": "web/tools/gen-readiness.mjs",
        "size": 3045,
        "sha256": "eb4d886d8764ad7f79491a5fdd674e9b1d2aff4f24c565a1b1d6a49bdfa168eb"
      },
      {
        "path": "web/tools/gen-wire.mjs",
        "size": 13489,
        "sha256": "6623eabe924ca50dfda2eeec79c5d53e4af4b7fffd3d75aa2ed68257c5dd5c42"
      }
    ]
  },
  "toolchain": {
    "cargo": "cargo 1.98.0-nightly (a595d0da2 2026-06-20)",
    "rustc": "rustc 1.98.0-nightly (91fe22da8 2026-06-21)",
    "node": "v26.4.0",
    "wasm_opt": "wasm-opt version 130",
    "target": "wasm32-unknown-unknown"
  },
  "archive_projection": {
    "live_input": {
      "path": "schema/live/live-tables-unit.tsv",
      "size": 102288,
      "sha256": "59f5287f4c3387617bfe76ab2610c24223b2220ee0bdf0e084aae028c57a90d5",
      "classification": "tracked-retail-live-derived-export-ignored",
      "export_ignore": true,
      "present": false
    },
    "former_consumer": {
      "path": "crates/don-sim/src/systems/leaders.rs",
      "size": 246882,
      "sha256": "c0a5976a6ed1a8df6a7b1e0f32ba75b1a05fcf135906a0c556f4cd283afaea82",
      "compile_time_literal_absent": true
    }
  },
  "build": {
    "outcome": "reproduced-byte-identical-candidate",
    "exit_code": 0,
    "raw_output": {
      "path": "web/wasm/target/wasm32-unknown-unknown/release/don_web.wasm",
      "size": 1092753,
      "sha256": "ac6c4100a23e760ffae81bc518adbd4119545f10b1957c2218b0e7ff5ce1f388"
    },
    "output": {
      "path": "web/public/wasm/don_web.wasm",
      "size": 869993,
      "sha256": "f7fb5c4767537352cc9bc043e34e76856f0e60630e234548beaa4fbc7a031181"
    },
    "source_inputs": [
      {
        "path": "crates/don-bhs/src/builtin_table.rs",
        "size": 178050,
        "sha256": "9a8f302334e63eb9ad4111c441e13ff686d385fbed38063304c7e2d8e1ed2917"
      },
      {
        "path": "crates/don-bhs/src/builtins.rs",
        "size": 20803,
        "sha256": "9e1e6b2f38bbee73e7a15417ddde51894d024fd3f9de9568df272f697652f0cf"
      },
      {
        "path": "crates/don-bhs/src/chunk.rs",
        "size": 35090,
        "sha256": "f5f593dfdff526937ef5f7f384146a1faf68dd8c248cd577b3616d8368f2252a"
      },
      {
        "path": "crates/don-bhs/src/corpus.rs",
        "size": 13341,
        "sha256": "592bf20687c6966ef8b59cb95c41a7041d86306eec897c41065f9464667d9f21"
      },
      {
        "path": "crates/don-bhs/src/disasm.rs",
        "size": 5239,
        "sha256": "458d924fcdb182b23fb679a81f9e37b9ead28ea3b653b60f4b3cdb5b47f8f8a9"
      },
      {
        "path": "crates/don-bhs/src/host.rs",
        "size": 13093,
        "sha256": "64a01446cb4163e09d65d560d7f51d7686940dd14054f7c0d563bdcb0b38c06d"
      },
      {
        "path": "crates/don-bhs/src/lib.rs",
        "size": 5175,
        "sha256": "c8a33e901a0bec616ab65f1db5b4ef9e43be00b331768e53df4d5fca75e4d371"
      },
      {
        "path": "crates/don-bhs/src/opcode.rs",
        "size": 15341,
        "sha256": "ed5d5a9b4479aaae613a3644b7aa1568d3736d69dd9bd3a71d20df33f8f05d9e"
      },
      {
        "path": "crates/don-bhs/src/ops.rs",
        "size": 17959,
        "sha256": "bf27cdebf105dae3c6105923f20fbf3f8f884412823ca2b31e89d23282234a9c"
      },
      {
        "path": "crates/don-bhs/src/program.rs",
        "size": 24571,
        "sha256": "8ec4417c49a8b26e17dbbcc1d850335727ba74aad7726a11388f62bb5662be97"
      },
      {
        "path": "crates/don-bhs/src/scenario.rs",
        "size": 45234,
        "sha256": "0dd4c0a617a8ba6adc3d2281972bf2b78ac3c1a769a77d60bf48c2e894238e53"
      },
      {
        "path": "crates/don-bhs/src/value.rs",
        "size": 16219,
        "sha256": "e905b894f36f47702c0ee139420870bc5b6bbf96a12d24da526cd5b660bbb079"
      },
      {
        "path": "crates/don-bhs/src/vm.rs",
        "size": 59061,
        "sha256": "2bced645b9b50f431fc16dfc478ade15fe79fb1913456f774659275f394c5d0f"
      },
      {
        "path": "crates/don-sim/src/balance.rs",
        "size": 10265,
        "sha256": "a42e67519c6ff2852681759f5a5245d098d45c1b0cf8146f535809cf358488fd"
      },
      {
        "path": "crates/don-sim/src/balance_path.rs",
        "size": 34129,
        "sha256": "4a1706affadafd251d67bb9a22faf97a942288aab404527ca0ca23fc7f4c616e"
      },
      {
        "path": "crates/don-sim/src/batch.rs",
        "size": 12205,
        "sha256": "ca91fb9c3d4c0545514275998439e5c36b8c219d3045c2086332171ddb52355d"
      },
      {
        "path": "crates/don-sim/src/bhs_session.rs",
        "size": 13533,
        "sha256": "a0c5c9c2a294ddf293367064b68f9edffbc2e1e3ba74557528fbb0e6d9623e22"
      },
      {
        "path": "crates/don-sim/src/checksum.rs",
        "size": 12142,
        "sha256": "2bd3c4367e8dd47be882e8b4d672d66d41834e7783c31566c647c97b36265298"
      },
      {
        "path": "crates/don-sim/src/command.rs",
        "size": 295131,
        "sha256": "500c3aa3565666f4b6a8f181fccdcfcafa88f38551c0fe10afa25ac1c76c816d"
      },
      {
        "path": "crates/don-sim/src/command_tables.rs",
        "size": 34904,
        "sha256": "07053a7e6a1adfab27d72f7c7d790f78eae9bda3641d46511e68748d3ea0b323"
      },
      {
        "path": "crates/don-sim/src/container.rs",
        "size": 14770,
        "sha256": "2212f205b8b5919948c3cbd3f1218e2a33ce87c76c3ee623a02ee0a857753cb1"
      },
      {
        "path": "crates/don-sim/src/deviations.rs",
        "size": 99340,
        "sha256": "5cb131ed15d67c12d25ff605c063f350fd8346cb5d917e7e4f0e622030c9b9e5"
      },
      {
        "path": "crates/don-sim/src/generated/mod.rs",
        "size": 317,
        "sha256": "e739c9c2c371e82cd88d4f7c939763df0eadfca817cfa1ac5f2e9681901fb489"
      },
      {
        "path": "crates/don-sim/src/generated/state.rs",
        "size": 719572,
        "sha256": "b10a376671ef0d8fd017d0ba9ece9fcc087a4cae118ad4e4e65453d0591ebadf"
      },
      {
        "path": "crates/don-sim/src/interleave.rs",
        "size": 10262,
        "sha256": "8c27dda3bdf9c3f726b7ac600282fdf901a4666a8a0aacd8ab196911ddd68878"
      },
      {
        "path": "crates/don-sim/src/item_runtime.rs",
        "size": 16923,
        "sha256": "ec86e08e8aa2d530c4a1b09e30fd760c94750bd34ccdee4a87718443c34b068c"
      },
      {
        "path": "crates/don-sim/src/lib.rs",
        "size": 4059,
        "sha256": "852d809cd8570fe3430fd7f8b94eee6795812b29dc10b087d30dcd3961ea3df8"
      },
      {
        "path": "crates/don-sim/src/mechanics.rs",
        "size": 88903,
        "sha256": "43d92ccc2d7d066cf1751af917acd33cb940a26ef08c4cab0b70224ba9d94684"
      },
      {
        "path": "crates/don-sim/src/objects.rs",
        "size": 14280,
        "sha256": "3ae3ee103611a61cc837cb1e3346888fd05af707cdd1b231d9683331c37ea3f4"
      },
      {
        "path": "crates/don-sim/src/order.rs",
        "size": 28443,
        "sha256": "898ee2ac2180c77e6538b49aa59170a1e8a1d7825798e4f27965c05d2301bf49"
      },
      {
        "path": "crates/don-sim/src/rng.rs",
        "size": 5553,
        "sha256": "169dbb0795547e374a55c114155609f4f035e57bcf25f546308dc73312ba8d0e"
      },
      {
        "path": "crates/don-sim/src/schedule.rs",
        "size": 13720,
        "sha256": "adc8dd04e3b9a92cbc72593e73ff4e68915ded074ac3fa46a0589dd58f0c252c"
      },
      {
        "path": "crates/don-sim/src/script_runtime.rs",
        "size": 92159,
        "sha256": "872c4eaf99df06ccb23c0db546c1d1df174900c87a7390d1e3e10b2d51e2a602"
      },
      {
        "path": "crates/don-sim/src/simd.rs",
        "size": 22685,
        "sha256": "8ed63a8705195095cbbed369d9c339d0bb3f3d2425a295c28429c1794a65ceb5"
      },